{
  "$schema": "https://json-schema.org/draft/2020-12/schema",
  "$id": "https://dediren.dev/schemas/model.schema.json",
  "type": "object",
  "additionalProperties": false,
  "required": ["model_schema_version", "nodes", "relationships", "plugins"],
  "properties": {
    "model_schema_version": { "const": "model.schema.v1" },
    "required_plugins": { "type": "array", "items": { "$ref": "#/$defs/pluginRequirement" } },
    "nodes": { "type": "array", "items": { "$ref": "#/$defs/sourceNode" } },
    "relationships": { "type": "array", "items": { "$ref": "#/$defs/sourceRelationship" } },
    "plugins": {
      "type": "object",
      "additionalProperties": true,
      "properties": {
        "generic-graph": { "$ref": "#/$defs/genericGraphPluginData" }
      }
    }
  },
  "$defs": {
    "pluginRequirement": {
      "type": "object",
      "additionalProperties": false,
      "required": ["id", "version"],
      "properties": {
        "id": { "type": "string", "pattern": "^[A-Za-z0-9][A-Za-z0-9._-]*$" },
        "version": { "type": "string", "minLength": 1 }
      }
    },
    "sourceNode": {
      "type": "object",
      "additionalProperties": false,
      "required": ["id", "type", "label", "properties"],
      "properties": {
        "id": { "type": "string", "pattern": "^[A-Za-z0-9][A-Za-z0-9._-]*$" },
        "type": { "type": "string", "minLength": 1 },
        "label": { "type": "string" },
        "properties": { "type": "object", "additionalProperties": true }
      }
    },
    "sourceRelationship": {
      "type": "object",
      "additionalProperties": false,
      "required": ["id", "type", "source", "target", "label", "properties"],
      "properties": {
        "id": { "type": "string", "pattern": "^[A-Za-z0-9][A-Za-z0-9._-]*$" },
        "type": { "type": "string", "minLength": 1 },
        "source": { "type": "string" },
        "target": { "type": "string" },
        "label": { "type": "string" },
        "properties": { "type": "object", "additionalProperties": true }
      }
    },
    "genericGraphPluginData": {
      "type": "object",
      "additionalProperties": false,
      "required": ["views"],
      "properties": {
        "semantic_profile": { "enum": ["generic-graph", "archimate"] },
        "views": {
          "type": "array",
          "items": { "$ref": "#/$defs/genericGraphView" }
        }
      }
    },
    "genericGraphView": {
      "type": "object",
      "additionalProperties": false,
      "required": ["id", "label", "nodes", "relationships"],
      "properties": {
        "id": { "type": "string", "pattern": "^[A-Za-z0-9][A-Za-z0-9._-]*$" },
        "label": { "type": "string" },
        "nodes": { "type": "array", "items": { "type": "string" } },
        "relationships": { "type": "array", "items": { "type": "string" } },
        "layout_preferences": { "$ref": "#/$defs/layoutPreferences" },
        "groups": {
          "type": "array",
          "items": { "$ref": "#/$defs/genericGraphViewGroup" }
        }
      }
    },
    "genericGraphViewGroup": {
      "type": "object",
      "additionalProperties": false,
      "required": ["id", "label", "members"],
      "properties": {
        "id": { "type": "string", "pattern": "^[A-Za-z0-9][A-Za-z0-9._-]*$" },
        "label": { "type": "string" },
        "members": { "type": "array", "items": { "type": "string" } },
        "role": { "enum": ["semantic-boundary", "layout-only"] },
        "semantic_source_id": { "type": "string" }
      }
    },
    "layoutPreferences": {
      "type": "object",
      "additionalProperties": false,
      "properties": {
        "direction": { "enum": ["right", "left", "down", "up"] },
        "density": { "enum": ["compact", "readable", "spacious"] },
        "wrapping": { "enum": ["auto", "off", "multi-edge"] },
        "routing": { "$ref": "#/$defs/layoutRoutingPreferences" }
      }
    },
    "layoutRoutingPreferences": {
      "type": "object",
      "additionalProperties": false,
      "properties": {
        "style": { "enum": ["orthogonal"] },
        "profile": { "enum": ["compact", "readable", "spacious"] },
        "endpoint_merging": { "enum": ["off", "local", "auto"] }
      }
    }
  }
}
