{"model_schema_version":"model.schema.v1","required_plugins":[{"id":"generic-graph","version":"2026.07.0"}],"nodes":[{"id":"client","type":"ApplicationComponent","label":"Client Application","properties":{"layer":"Application","viewpoint":"Application Cooperation"}},{"id":"orders-component","type":"ApplicationComponent","label":"Orders Component","properties":{"layer":"Application","viewpoint":"Application Cooperation"}},{"id":"orders-api","type":"ApplicationInterface","label":"Orders API","properties":{"layer":"Application","viewpoint":"Application Cooperation"}},{"id":"orders-service","type":"ApplicationService","label":"Orders Service","properties":{"layer":"Application","viewpoint":"Application Cooperation"}}],"relationships":[{"id":"orders-component-provides-api","type":"Composition","source":"orders-component","target":"orders-api","label":"provides","properties":{"visible":true}},{"id":"orders-component-realizes-service","type":"Realization","source":"orders-component","target":"orders-service","label":"realizes","properties":{"visible":true}},{"id":"orders-service-serves-client","type":"Serving","source":"orders-service","target":"client","label":"serves","properties":{"visible":true}}],"plugins":{"generic-graph":{"semantic_profile":"archimate","views":[{"id":"main","label":"Basic - Application Cooperation","nodes":["client","orders-component","orders-api","orders-service"],"relationships":["orders-component-provides-api","orders-component-realizes-service","orders-service-serves-client"]}]}}}
